{
  "items": [
    {
      "id": "part-1",
      "orderId": "job-1",
      "partNo": "A-001",
      "drawingName": "door-A-001.dxf",
      "material": "Q235",
      "thickness": 3,
      "quantity": 6,
      "status": "ready",
      "updatedAt": "2026-02-13T02:00:00.000Z",
      "orderCode": "JOB-2026-0001",
      "orderName": "机柜门板-批次A"
    }
  ],
  "total": 1,
  "page": 1,
  "pageSize": 50,
  "totalPages": 1
}
